{"version":1,"default":{"action":"block"},"source_contract_sha":"403c60bbadb734d870a22c372aca8a988e348d21","freshness_max_age_ms":{"orchestration.dispatch":30000,"orchestration.workerStart":30000,"orchestration.workerStop":15000,"orchestration.workerAbandon":15000,"orchestration.workerShow":15000},"observation":{"interval_ms":60000,"qualifying_checkpoints":3,"probe_timeout_ms":60000,"default_ceiling_ms":2700000},"rules":[{"id":"dispatch-owner","match":{"normalized_command":"orchestration.dispatch","state_class":"OK"},"action":"require_approval"},{"id":"worker-start-owner","match":{"normalized_command":"orchestration.workerStart","state_class":"OK"},"action":"require_approval"},{"id":"worker-stop-owner","match":{"normalized_command":"orchestration.workerStop","state_class":"OK"},"action":"require_approval"},{"id":"worker-abandon-owner","match":{"normalized_command":"orchestration.workerAbandon","state_class":"OK"},"action":"require_approval"},{"id":"worker-show-owner","match":{"normalized_command":"orchestration.workerShow","state_class":"OK"},"action":"require_approval"},{"id":"dispatch-preview","match":{"normalized_command":"orchestration.dispatchDryRun","state_class":"OK"},"action":"allow"},{"id":"run-current-read","match":{"normalized_command":"orchestration.runCurrent","state_class":"OK"},"action":"allow"},{"id":"run-show-read","match":{"normalized_command":"orchestration.runShow","state_class":"OK"},"action":"allow"},{"id":"task-list-read","match":{"normalized_command":"orchestration.taskList","state_class":"OK"},"action":"allow"},{"id":"dispatch-show-read","match":{"normalized_command":"orchestration.dispatchShow","state_class":"OK"},"action":"allow"},{"id":"worker-read-local","match":{"normalized_command":"orchestration.workerRead","state_class":"OK"},"action":"allow"},{"id":"terminal-read-bound","match":{"normalized_command":"terminal.read","state_class":"OK"},"action":"allow"},{"id":"terminal-wait-bound","match":{"normalized_command":"terminal.wait","state_class":"OK"},"action":"allow"}]}
