{"version":1,"default":{"action":"block"},"source_contract_sha":"403c60bbadb734d870a22c372aca8a988e348d21","freshness_max_age_ms":{"orchestration.dispatch":30000,"orchestration.workerStart":30000,"orchestration.workerStop":30000,"orchestration.workerAbandon":30000,"orchestration.workerShow":30000},"observation":{"interval_ms":60000,"qualifying_checkpoints":3,"probe_timeout_ms":60000,"default_ceiling_ms":2700000},"rules":[]}
